<!ELEMENT banco (sucursal+)>
<!ELEMENT sucursal (cuenta+)>
<!ATTLIST sucursal id NMTOKEN #REQUIRED>
<!ELEMENT cuenta (cliente+)>
<!ATTLIST cuenta iban NMTOKEN #REQUIRED>
<!ELEMENT cliente (nombre,apellidos,telefono)>
<!ATTLIST cliente dni NMTOKEN #IMPLIED>
<!ELEMENT nombre (#PCDATA)>
<!ELEMENT apellidos (#PCDATA)>
<!ELEMENT telefono (#PCDATA)>